{
  "$schema": "https://json-schema.org/draft/2020-12/schema",
  "$id": "Scene.schema.json",
  "type": "object",
  "description": "A particular scene in the game, either a room or a standalone decision tree",
  "properties": {
    "id": {
      "type": "string",
      "description": "A unique identifier for this scene"
    },
    "name": {
      "type": "string",
      "description": "Header text for the room to be displayed in-game"
    },
    "description": {
      "type": "string",
      "description": "Descriptive text for the room to be displayed in-game"
    },
    "actions": {
      "type": "array",
      "description": "Actions that are available unconditionally",
      "items": {
        "$ref": "Action.schema.json"
      }
    },
    "conditions": {
      "type": "array",
      "description": "Actions and descriptions that are available unconditionally",
      "items": {
        "$ref": "Condition.schema.json"
      }
    }
  },
  "required": ["id", "name"],
  "additionalProperties": false
}
